{
  "schemaVersion": 1,
  "matrixVersion": "p1-s04",
  "upstreamCommit": "2175f8a629257efb08214e093704b3a3d3d06d05",
  "runtimeIntegrationVersion": "headless-p0.5.1",
  "protocolVersion": 6,
  "capabilitySetDigest": "9a5d4b9b8eef946adc5566bc9ae2aa88881bbfd9f1ec27628c52564956de6ef8",
  "capabilities": [
    {
      "capabilityId": "console.text-lines",
      "upstreamCommit": "2175f8a629257efb08214e093704b3a3d3d06d05",
      "upstreamEntrypoints": [
        "HeadlessEmueraConsole.Print", "HeadlessEmueraConsole.PrintC", "HeadlessEmueraConsole.PrintPlain", "HeadlessEmueraConsole.PrintPlainWithSingleLineFix", "HeadlessEmueraConsole.PrintSingleLine", "HeadlessEmueraConsole.PrintTemporaryLine", "HeadlessEmueraConsole.PrintBar", "HeadlessEmueraConsole.printCustomBar", "HeadlessEmueraConsole.NewLine", "HeadlessEmueraConsole.PrintFlush", "HeadlessEmueraConsole.RefreshStrings", "HeadlessEmueraConsole.ClearText", "HeadlessEmueraConsole.ClearDisplay", "HeadlessEmueraConsole.deleteLine",
        "PRINT", "PRINTL", "PRINTFORM", "PRINTFORML", "PRINTDATA"
      ],
      "category": "console",
      "classification": "Supported",
      "reasonCode": "STRUCTURED_LINE_STATE",
      "adapterTypes": ["ConsoleLine", "TextNode", "PositionedInlineSegmentNode", "ConsoleTextStyle", "ConsoleStateStore"],
      "ipcTypes": ["ConsoleLine", "ConsoleNode", "PositionedInlineSegmentNode", "AppendLine", "AppendInline", "ReplaceLine", "DeleteLines", "ClearScrollback"],
      "fixtureScenarios": ["v18-core/input-roundtrip", "em-ee-core/input-roundtrip"],
      "testNames": ["StructuredConsoleContractTests.RichTransactionIsAtomicAndPublishesOneSequence", "StructuredConsoleContractTests.ScrollbackTrimsOldCompleteLinesAndReportsDroppedCounts"],
      "securityNotes": ["Only bounded text/style nodes cross the boundary; raw HTML and host paths are excluded.", "Scrollback is trimmed by complete lines and never by renderer-side guessing."]
    },
    {
      "capabilityId": "console.buttons",
      "upstreamCommit": "2175f8a629257efb08214e093704b3a3d3d06d05",
      "upstreamEntrypoints": ["HeadlessEmueraConsole.PrintButton", "HeadlessEmueraConsole.PrintButtonC", "HeadlessEmueraConsole.UpdateGeneration", "HeadlessEmueraConsole.forceUpdateGeneration", "HeadlessEmueraConsole.LastButtonGeneration", "HeadlessEmueraConsole.NewButtonGeneration", "PRINTBUTTON", "PRINTBUTTONC", "PRINTBUTTONLC"],
      "category": "console",
      "classification": "Supported",
      "reasonCode": "STRUCTURED_BUTTON_NODE",
      "adapterTypes": ["ButtonNode", "ConsoleInputCoordinator"],
      "ipcTypes": ["ButtonNode", "InputSource", "SubmitInput"],
      "fixtureScenarios": ["v18-core/input-roundtrip"],
      "testNames": ["StructuredTimedInputContractTests.OneInputAndSourceConstraintAreAppliedBeforeAcceptance"],
      "securityNotes": ["Button values are bounded opaque input values and do not become URLs or executable markup."]
    },
    {
      "capabilityId": "console.styles-layout",
      "upstreamCommit": "2175f8a629257efb08214e093704b3a3d3d06d05",
      "upstreamEntrypoints": ["HeadlessEmueraConsole.SetStringStyle", "HeadlessEmueraConsole.SetFont", "HeadlessEmueraConsole.SetBgColor", "HeadlessEmueraConsole.ResetStyle", "HeadlessEmueraConsole.StringStyle", "HeadlessEmueraConsole.Alignment", "PRINTFORMW", "BOLD", "ITALIC", "UNDERLINE", "STRIKE", "SETCOLOR", "SETBGCOLOR"],
      "category": "font",
      "classification": "Supported",
      "reasonCode": "LOGICAL_FONT_AND_ALIGNMENT",
      "adapterTypes": ["ConsoleTextStyle", "ConsoleFontSpec", "ConsoleLineAlignment", "ConsoleLine.LayoutWidth", "WindowMetadata.FontFaceId"],
      "ipcTypes": ["TextStyle", "LineAlignment", "WindowMetadata", "PositionedInlineSegmentNode"],
      "fixtureScenarios": ["v18-core/input-roundtrip", "em-ee-core/input-roundtrip"],
      "testNames": ["StructuredConsoleContractTests.RichTransactionIsAtomicAndPublishesOneSequence"],
      "securityNotes": ["Font names are logical manifest identifiers, never host font lookup names.", "Coordinates and metrics are finite and bounded."]
    },
    {
      "capabilityId": "console.html",
      "upstreamCommit": "2175f8a629257efb08214e093704b3a3d3d06d05",
      "upstreamEntrypoints": ["HtmlManager.ParseFragment", "HeadlessEmueraConsole.PrintHtml", "HTML_PRINT"],
      "category": "html",
      "classification": "Supported",
      "reasonCode": "STRUCTURED_EMUERA_PSEUDO_HTML",
      "adapterTypes": ["UpstreamHtmlFragment", "UpstreamHtmlTranslator", "TextNode", "LineBreakNode", "ButtonNode", "SpriteNode", "ShapeNode", "DivNode", "ConsoleBoxModel", "ConsoleLineAlignment", "ConsoleLine.NoWrap"],
      "ipcTypes": ["TextNode", "LineBreakNode", "ButtonNode", "SpriteNode", "ShapeNode", "DivNode", "BoxModel", "TextStyle", "LineAlignment", "ConsoleLine.no_wrap"],
      "fixtureScenarios": ["v18-core/input-roundtrip", "em-ee-core/input-roundtrip"],
      "testNames": ["HeadlessRuntimeFixtureTests.HtmlPrintUsesUpstreamStylesEntitiesAndOmittedParagraphClosures", "HeadlessRuntimeFixtureTests.UpstreamDesktopEntrypointsAndHeadlessParseFragmentShareButtonSemantics", "HeadlessRuntimeFixtureTests.HtmlPrintRealFixturePreservesUpstreamOmissionAndInterleavedStyleState", "HeadlessRuntimeFixtureTests.HtmlPrintPreservesButtonMetadataAndClearbuttonDisablesSelection", "HeadlessRuntimeFixtureTests.HtmlPrintMapsImageVariantsAndMixedNumberGeometryThroughTheResolver", "HeadlessRuntimeFixtureTests.HtmlPrintMapsDivBoxModelAndAbsoluteLayoutWithoutReparsingAltText", "HeadlessRuntimeFixtureTests.HtmlPrintBudgetRejectionDoesNotConsumePendingOutput", "HeadlessRuntimeFixtureTests.HtmlPrintDoesNotCreateAnExtraLineAfterAnUpstreamTrailingBreak", "HeadlessRuntimeFixtureTests.HtmlPrintResolvesCsvSpriteAndParagraphAlignment", "HeadlessRuntimeFixtureTests.HtmlPrintIslandUsesTheSameUpstreamParserAndStructuredNodes", "HeadlessRuntimeFixtureTests.HtmlPrintBufferKeepsUpstreamBreaksInsideThePrintBufferBoundary", "StructuredConsoleWireMapperTests.SnapshotMapperPreservesScrollbackSceneMediaAndPrompt"],
      "securityNotes": ["The pinned upstream HtmlManager is the sole Emuera pseudo-HTML authority; the headless translator applies independent input, resource, geometry and output budgets.", "Image names are resolved through the session manifest into bounded SpriteNodes; raw HTML, browser URLs and desktop objects never cross the runtime or realtime boundary."]
    },
    {
      "capabilityId": "console.html-island",
      "upstreamCommit": "2175f8a629257efb08214e093704b3a3d3d06d05",
      "upstreamEntrypoints": ["HeadlessEmueraConsole.PrintHTMLIsland", "HeadlessEmueraConsole.ClearHTMLIsland", "HTML_PRINT_ISLAND", "HTML_PRINT_ISLAND_CLEAR"],
      "category": "html",
      "classification": "Supported",
      "reasonCode": "UPSTREAM_STRUCTURED_HTML_ISLAND",
      "adapterTypes": ["UpstreamHtmlFragment", "UpstreamHtmlTranslator", "HtmlIslandNode", "HtmlIslandDrawable"],
      "ipcTypes": ["ConsoleNode", "HtmlIslandNode", "HtmlIslandDrawable"],
      "fixtureScenarios": ["structured-html-island"],
      "testNames": ["HeadlessRuntimeFixtureTests.HtmlPrintIslandUsesTheSameUpstreamParserAndStructuredNodes", "StructuredConsoleWireMapperTests.SnapshotMapperPreservesScrollbackSceneMediaAndPrompt"],
      "securityNotes": ["Island output uses the same upstream parser as HTML_PRINT and carries only validated structured nodes and manifest asset identifiers; it never carries raw HTML or a URL."]
    },
    {
      "capabilityId": "console.images-sprites",
      "upstreamCommit": "2175f8a629257efb08214e093704b3a3d3d06d05",
      "upstreamEntrypoints": ["HeadlessEmueraConsole.PrintImg", "PRINT_IMG"],
      "category": "image",
      "classification": "Supported",
      "reasonCode": "MANIFEST_ASSET_SPRITE_GEOMETRY",
      "adapterTypes": ["SpriteNode", "SpriteAnimationFrame", "ImageNode", "RuntimeImageMetadataPort"],
      "ipcTypes": ["SpriteNode", "SpriteAnimationFrame", "ImageNode", "Rect"],
      "fixtureScenarios": ["v18-core/input-roundtrip", "em-ee-core/input-roundtrip", "animated-sprite-csv"],
      "testNames": ["HeadlessRuntimeFixtureTests.TranscriptProjectionDoesNotInventImageText", "HeadlessRuntimeFixtureTests.AnimatedSpriteCsvPublishesAllFramesWithTiming", "StructuredConsoleWireMapperTests.SnapshotMapperPreservesScrollbackSceneMediaAndPrompt"],
      "securityNotes": ["Only Session manifest asset IDs and validated source/destination rectangles cross the protocol."]
    },
    {
      "capabilityId": "console.shapes",
      "upstreamCommit": "2175f8a629257efb08214e093704b3a3d3d06d05",
      "upstreamEntrypoints": ["HeadlessEmueraConsole.PrintShape", "PRINT_RECT", "PRINT_SPACE"],
      "category": "drawing",
      "classification": "Supported",
      "reasonCode": "BOUNDED_SHAPE_PRIMITIVES",
      "adapterTypes": ["ShapeNode", "ShapeDrawable", "ConsoleRect", "ConsolePoint"],
      "ipcTypes": ["ShapeNode", "ShapeDrawable", "Rect", "Point"],
      "fixtureScenarios": ["structured-shapes"],
      "testNames": ["StructuredConsoleContractTests.RichTransactionIsAtomicAndPublishesOneSequence"],
      "securityNotes": ["Only the finite rectangle, ellipse, line, polygon and space vocabulary is accepted; geometry has point and coordinate limits."]
    },
    {
      "capabilityId": "console.backgrounds",
      "upstreamCommit": "2175f8a629257efb08214e093704b3a3d3d06d05",
      "upstreamEntrypoints": ["HeadlessEmueraConsole.AddBackgroundImage", "HeadlessEmueraConsole.ClearBackgroundImage", "HeadlessEmueraConsole.RemoveBackground", "SETBGIMAGE", "CLEARBGIMAGE", "REMOVEBGIMAGE"],
      "category": "drawing",
      "classification": "Supported",
      "reasonCode": "BOUNDED_BACKGROUND_LAYER",
      "adapterTypes": ["BackgroundLayer", "ConsoleBackgroundMode", "ConsoleStateStore"],
      "ipcTypes": ["BackgroundLayer", "UpsertBackground", "RemoveBackground", "ClearBackgrounds"],
      "fixtureScenarios": ["structured-background"],